{
  "$schema": "http://json-schema.org/draft-07/schema#",
  "$id": "urn:pulso:v3:work:1",
  "title": "Pulso v3 work",
  "type": "object",
  "additionalProperties": false,
  "properties": {
    "schemaVersion": {
      "const": 1
    },
    "id": {
      "type": "string",
      "pattern": "^[A-Za-z0-9][A-Za-z0-9_-]{0,79}$"
    },
    "revision": {
      "type": "integer",
      "minimum": 1
    },
    "cycle": {
      "type": "integer",
      "minimum": 1
    },
    "title": {
      "type": "string",
      "minLength": 1
    },
    "objective": {
      "type": "object",
      "additionalProperties": false,
      "properties": {
        "id": {
          "type": "string",
          "pattern": "^[A-Za-z0-9][A-Za-z0-9_-]{0,79}$"
        },
        "outcome": {
          "type": "string",
          "minLength": 1
        },
        "criteria": {
          "type": "array",
          "items": {
            "type": "object",
            "additionalProperties": false,
            "properties": {
              "id": {
                "type": "string",
                "pattern": "^[A-Za-z0-9][A-Za-z0-9_-]{0,79}$"
              },
              "description": {
                "type": "string",
                "minLength": 1
              },
              "verification": {
                "type": "string",
                "minLength": 1
              },
              "evidenceIds": {
                "type": "array",
                "items": {
                  "type": "string",
                  "pattern": "^[A-Za-z0-9][A-Za-z0-9_-]{0,79}$"
                },
                "minItems": 0
              }
            },
            "required": [
              "id",
              "description",
              "verification",
              "evidenceIds"
            ]
          },
          "minItems": 1
        }
      },
      "required": [
        "id",
        "outcome",
        "criteria"
      ]
    },
    "status": {
      "enum": [
        "pending",
        "in_progress",
        "blocked",
        "paused",
        "done",
        "cancelled"
      ]
    },
    "priority": {
      "enum": [
        "low",
        "normal",
        "high",
        "critical"
      ]
    },
    "createdAt": {
      "type": "string",
      "format": "date-time"
    },
    "updatedAt": {
      "type": "string",
      "format": "date-time"
    },
    "summary": {
      "type": "string"
    },
    "blockers": {
      "type": "array",
      "items": {
        "type": "string",
        "minLength": 1
      },
      "minItems": 0
    },
    "decisionsPending": {
      "type": "array",
      "items": {
        "type": "string",
        "minLength": 1
      },
      "minItems": 0
    },
    "nextAction": {
      "anyOf": [
        {
          "type": "string",
          "minLength": 1
        },
        {
          "type": "null"
        }
      ]
    },
    "documents": {
      "type": "array",
      "items": {
        "type": "object",
        "additionalProperties": false,
        "properties": {
          "kind": {
            "enum": [
              "work",
              "spec",
              "plan",
              "research",
              "review",
              "decision",
              "delivery",
              "evidence"
            ]
          },
          "path": {
            "type": "string",
            "minLength": 1,
            "pattern": "^(?!/)(?!.*\\\\)(?!.*(?:^|/)\\.\\.(?:/|$))(?![A-Za-z]:)[^\\u0000]+$"
          },
          "templateVersion": {
            "type": "string",
            "minLength": 1
          }
        },
        "required": [
          "kind",
          "path",
          "templateVersion"
        ]
      },
      "minItems": 0
    },
    "tasks": {
      "type": "array",
      "items": {
        "type": "object",
        "additionalProperties": false,
        "properties": {
          "id": {
            "type": "string",
            "pattern": "^[A-Za-z0-9][A-Za-z0-9_-]{0,79}$"
          },
          "title": {
            "type": "string",
            "minLength": 1
          },
          "criterionIds": {
            "type": "array",
            "items": {
              "type": "string",
              "pattern": "^[A-Za-z0-9][A-Za-z0-9_-]{0,79}$"
            },
            "minItems": 1
          },
          "agent": {
            "anyOf": [
              {
                "enum": [
                  "pulso-researcher",
                  "pulso-explorer",
                  "pulso-planner",
                  "pulso-plan-auditor",
                  "pulso-executor",
                  "pulso-qa-auditor",
                  "pulso-security-auditor",
                  "pulso-code-reviewer",
                  "pulso-ui-auditor"
                ]
              },
              {
                "type": "null"
              }
            ]
          },
          "status": {
            "enum": [
              "pending",
              "in_progress",
              "blocked",
              "paused",
              "done",
              "cancelled"
            ]
          },
          "dependsOn": {
            "type": "array",
            "items": {
              "type": "string",
              "pattern": "^[A-Za-z0-9][A-Za-z0-9_-]{0,79}$"
            },
            "minItems": 0
          },
          "writeScope": {
            "type": "array",
            "items": {
              "type": "string",
              "minLength": 1,
              "pattern": "^(?!/)(?!.*\\\\)(?!.*(?:^|/)\\.\\.(?:/|$))(?![A-Za-z]:)[^\\u0000]+$"
            },
            "minItems": 0
          },
          "resources": {
            "type": "array",
            "items": {
              "type": "string",
              "minLength": 1
            },
            "minItems": 0
          },
          "acceptance": {
            "type": "array",
            "items": {
              "type": "string",
              "minLength": 1
            },
            "minItems": 1
          },
          "evidenceIds": {
            "type": "array",
            "items": {
              "type": "string",
              "pattern": "^[A-Za-z0-9][A-Za-z0-9_-]{0,79}$"
            },
            "minItems": 0
          },
          "summary": {
            "type": "string"
          }
        },
        "required": [
          "id",
          "title",
          "criterionIds",
          "agent",
          "status",
          "dependsOn",
          "writeScope",
          "resources",
          "acceptance",
          "evidenceIds",
          "summary"
        ]
      },
      "minItems": 0
    },
    "evidence": {
      "type": "array",
      "items": {
        "type": "object",
        "additionalProperties": false,
        "properties": {
          "id": {
            "type": "string",
            "pattern": "^[A-Za-z0-9][A-Za-z0-9_-]{0,79}$"
          },
          "kind": {
            "enum": [
              "executed",
              "manual",
              "static",
              "not_run"
            ]
          },
          "status": {
            "enum": [
              "pass",
              "fail",
              "blocked",
              "not_run"
            ]
          },
          "checkedAt": {
            "type": "string",
            "format": "date-time"
          },
          "criterionIds": {
            "type": "array",
            "items": {
              "type": "string",
              "pattern": "^[A-Za-z0-9][A-Za-z0-9_-]{0,79}$"
            },
            "minItems": 0
          },
          "taskIds": {
            "type": "array",
            "items": {
              "type": "string",
              "pattern": "^[A-Za-z0-9][A-Za-z0-9_-]{0,79}$"
            },
            "minItems": 0
          },
          "report": {
            "type": "string",
            "minLength": 1,
            "pattern": "^(?!/)(?!.*\\\\)(?!.*(?:^|/)\\.\\.(?:/|$))(?![A-Za-z]:)[^\\u0000]+$"
          },
          "command": {
            "anyOf": [
              {
                "type": "string",
                "minLength": 1
              },
              {
                "type": "null"
              }
            ]
          },
          "cwd": {
            "type": "string",
            "minLength": 1,
            "pattern": "^(?!/)(?!.*\\\\)(?!.*(?:^|/)\\.\\.(?:/|$))(?![A-Za-z]:)[^\\u0000]+$"
          },
          "exitCode": {
            "anyOf": [
              {
                "type": "integer"
              },
              {
                "type": "null"
              }
            ]
          },
          "basis": {
            "type": "string",
            "minLength": 1
          },
          "files": {
            "type": "array",
            "items": {
              "type": "object",
              "additionalProperties": false,
              "properties": {
                "path": {
                  "type": "string",
                  "minLength": 1,
                  "pattern": "^(?!/)(?!.*\\\\)(?!.*(?:^|/)\\.\\.(?:/|$))(?![A-Za-z]:)[^\\u0000]+$"
                },
                "sha256": {
                  "type": "string",
                  "pattern": "^[a-f0-9]{64}$"
                }
              },
              "required": [
                "path",
                "sha256"
              ]
            },
            "minItems": 1
          },
          "summary": {
            "type": "string",
            "minLength": 1
          }
        },
        "required": [
          "id",
          "kind",
          "status",
          "checkedAt",
          "criterionIds",
          "taskIds",
          "report",
          "command",
          "cwd",
          "exitCode",
          "basis",
          "files",
          "summary"
        ]
      },
      "minItems": 0
    },
    "closure": {
      "anyOf": [
        {
          "type": "object",
          "additionalProperties": false,
          "properties": {
            "id": {
              "type": "string",
              "minLength": 1
            },
            "cycle": {
              "type": "integer",
              "minimum": 1
            },
            "at": {
              "type": "string",
              "format": "date-time"
            },
            "outcome": {
              "enum": [
                "done",
                "cancelled"
              ]
            },
            "summary": {
              "type": "string",
              "minLength": 1
            },
            "evidenceIds": {
              "type": "array",
              "items": {
                "type": "string",
                "pattern": "^[A-Za-z0-9][A-Za-z0-9_-]{0,79}$"
              },
              "minItems": 0
            },
            "limitations": {
              "type": "array",
              "items": {
                "type": "string",
                "minLength": 1
              },
              "minItems": 0
            }
          },
          "required": [
            "id",
            "cycle",
            "at",
            "outcome",
            "summary",
            "evidenceIds",
            "limitations"
          ]
        },
        {
          "type": "null"
        }
      ]
    }
  },
  "required": [
    "schemaVersion",
    "id",
    "revision",
    "cycle",
    "title",
    "objective",
    "status",
    "priority",
    "createdAt",
    "updatedAt",
    "summary",
    "blockers",
    "decisionsPending",
    "nextAction",
    "documents",
    "tasks",
    "evidence",
    "closure"
  ]
}
