{
  "schemaVersion": 1,
  "id": "EXAMPLE-1",
  "revision": 1,
  "cycle": 1,
  "title": "Ejemplo: sustituir por el trabajo real",
  "objective": {
    "id": "OBJ-1",
    "outcome": "Resultado observable del trabajo de ejemplo.",
    "criteria": [
      {
        "id": "AC-1",
        "description": "El resultado cumple el comportamiento acordado.",
        "verification": "Comprobación específica por definir con el usuario/proyecto antes de ejecutar.",
        "evidenceIds": []
      }
    ]
  },
  "status": "pending",
  "priority": "normal",
  "createdAt": "2026-09-29T00:00:00.000Z",
  "updatedAt": "2026-09-29T00:00:00.000Z",
  "summary": "",
  "blockers": [],
  "decisionsPending": [],
  "nextAction": "Confirmar alcance y verificación",
  "documents": [],
  "tasks": [
    {
      "id": "T-1",
      "title": "Implementar el alcance acordado",
      "criterionIds": [
        "AC-1"
      ],
      "agent": "pulso-executor",
      "status": "pending",
      "dependsOn": [],
      "writeScope": [
        "src/example.js"
      ],
      "resources": [],
      "acceptance": [
        "Verificar AC-1 según el contrato acordado."
      ],
      "evidenceIds": [],
      "summary": ""
    }
  ],
  "evidence": [],
  "closure": null
}
